{
  "schema_version": "2.0",
  "id": "okinawa-ishigaki-taketomi-3n4d-route",
  "slug": "okinawa-ishigaki-taketomi-3n4d-route",
  "aliases": [],
  "title": "沖縄・石垣・竹富島 3泊4日 ルートマップ（LINE反映・修正版）",
  "type": "plan",
  "category": "travel",
  "subcategory": null,
  "summary": "沖縄本島・石垣島・竹富島を3泊4日で巡る旅程資料。4日間の時刻表、SSスポット、飛行機・レンタカー・フェリー移動、LINE反映ポイント、予約確認事項をスマホ向けに整理する。",
  "tags": [
    "沖縄旅行",
    "石垣島",
    "竹富島",
    "3泊4日",
    "旅行プラン",
    "ルートマップ"
  ],
  "status": "draft",
  "visibility": "private",
  "publish": false,
  "version": "1.0",
  "language": "ja",
  "dates": {
    "created": "2026-08-26",
    "updated": "2026-08-26"
  },
  "files": {
    "source": "okinawa-ishigaki-taketomi-3n4d-route_source.md",
    "guide": "okinawa-ishigaki-taketomi-3n4d-route_guide.html",
    "preview": "okinawa-ishigaki-taketomi-3n4d-route_preview.webp",
    "thumbnail": "okinawa-ishigaki-taketomi-3n4d-route_thumb.webp",
    "additional": [
      "artifact-manifest.json"
    ]
  },
  "media": {
    "preview": {
      "alt": "沖縄・石垣・竹富島の3泊4日旅行を、DAY1〜DAY4の日程、地図ルート、SSスポット、LINE反映ポイント、予約確認事項で整理した旅程図。",
      "width": 1448,
      "height": 1086,
      "bytes": 1643356,
      "format": "webp"
    },
    "thumbnail": {
      "alt": "沖縄・石垣・竹富島の3泊4日旅行を、DAY1〜DAY4の日程、地図ルート、SSスポット、LINE反映ポイント、予約確認事項で整理した旅程図。",
      "width": 640,
      "height": 480,
      "bytes": 383018,
      "format": "webp"
    }
  },
  "search": {
    "keywords": [
      "沖縄",
      "石垣",
      "竹富",
      "古宇利島",
      "西桟橋",
      "御神崎",
      "星のや竹富島",
      "ウミカジテラス",
      "旅行日程",
      "レンタカー",
      "フェリー"
    ]
  },
  "relations": {
    "parent_id": null,
    "related_ids": []
  },
  "integrity": {
    "source_sha256": "95e3331cdea384c5478011cf313fc93a0daa485efe8313eacfa0c70cc1441077",
    "guide_sha256": "5cd0f7875cc6ca830263cdb8f9dcb54ffce6bfa44198ba73b224c142e71163ae",
    "preview_sha256": "83b572ef39aa45330bd64b528eaa725019b9a711f21e7b496aeb298ea91fff8b",
    "thumbnail_sha256": "54cd6fa2a44f5f021c68f85b2dcba4a9e0dc9736a176a5282910a2f9aa4d96b0",
    "guide_generated_from_source_sha256": "95e3331cdea384c5478011cf313fc93a0daa485efe8313eacfa0c70cc1441077",
    "preview_generated_from_source_sha256": "95e3331cdea384c5478011cf313fc93a0daa485efe8313eacfa0c70cc1441077",
    "thumbnail_generated_from_preview_sha256": "83b572ef39aa45330bd64b528eaa725019b9a711f21e7b496aeb298ea91fff8b"
  },
  "provenance": {
    "source_origin": "user-provided itinerary image (PNG) transcribed into Markdown",
    "guide_generator_prompt_id": "html-guide-generator",
    "guide_generator_prompt_version": "2.0",
    "guide_generated_at": "2026-08-26T20:36:00+09:00",
    "preview_generator_prompt_id": "visual-preview-generator",
    "preview_generator_prompt_version": "2.2",
    "preview_generated_at": "2026-08-26T20:36:00+09:00"
  }
}
