{
  "schema_version": "2.0",
  "id": "visual-director-4-variants",
  "slug": "visual-director-4-variants",
  "aliases": [],
  "title": "ChatGPT用 視覚表現自動選択・4案個別生成マスタープロンプト",
  "type": "prompt",
  "category": "prompts",
  "subcategory": "image-generation",
  "summary": "文章・ニュース・学習・旅行・技術などを分析し、構造・役割・視線の流れが異なる4案を設計・生成するための再利用プロンプト。",
  "tags": [
    "画像生成",
    "ChatGPT",
    "プロンプト",
    "情報設計",
    "図解",
    "スマホ最適化"
  ],
  "status": "active",
  "visibility": "public",
  "publish": true,
  "version": "2.0",
  "language": "ja",
  "dates": {
    "created": "2026-08-24",
    "updated": "2026-08-25"
  },
  "files": {
    "source": "visual-director-4-variants_prompt.md",
    "guide": "visual-director-4-variants_guide.html",
    "preview": "visual-director-4-variants_preview.webp",
    "thumbnail": "visual-director-4-variants_thumb.webp",
    "additional": [
      "visual-director-4-variants_design-notes.md",
      "visual-director-4-variants_preview-manifest.json"
    ]
  },
  "media": {
    "preview": {
      "alt": "視覚表現自動選択・4案個別生成マスタープロンプトを、4つの異なる役割カードで表したプレビュー画像",
      "width": 1200,
      "height": 1500,
      "bytes": 50010,
      "format": "webp"
    },
    "thumbnail": {
      "alt": "視覚表現自動選択・4案個別生成マスタープロンプトを、4つの異なる役割カードで表したプレビュー画像",
      "width": 640,
      "height": 800,
      "bytes": 21564,
      "format": "webp"
    }
  },
  "search": {
    "keywords": [
      "視覚表現",
      "4案生成",
      "ChatGPT Images",
      "画像生成AI",
      "インフォグラフィック",
      "アートディレクション",
      "比較図解",
      "Visual Director",
      "マスタープロンプト"
    ]
  },
  "relations": {
    "parent_id": null,
    "related_ids": []
  },
  "integrity": {
    "source_sha256": "bc902b5e4e98b5e047074a06766d27f9ab980493ba06d387b0f8397ce1714f22",
    "guide_sha256": "bc086d387e1dd66f05706aa356d52a13bf7977413e96f4d53b13cebd2ef63d49",
    "preview_sha256": "ff0e5bdae6ea6d2e0d9d3dbfc1340c4dfb60ac8df2f6c1abbef293b61c95a9b9",
    "thumbnail_sha256": "edbbfd774b5ae6c574587f2a34fb9a89b7daff2f4ac511afd12909f04be656d0",
    "guide_generated_from_source_sha256": "bc902b5e4e98b5e047074a06766d27f9ab980493ba06d387b0f8397ce1714f22",
    "preview_generated_from_source_sha256": "bc902b5e4e98b5e047074a06766d27f9ab980493ba06d387b0f8397ce1714f22",
    "thumbnail_generated_from_preview_sha256": "ff0e5bdae6ea6d2e0d9d3dbfc1340c4dfb60ac8df2f6c1abbef293b61c95a9b9"
  },
  "provenance": {
    "source_origin": "user-provided-markdown / Prompt Architect extraction",
    "guide_generator_prompt_id": "html-guide-generator",
    "guide_generator_prompt_version": "2.0",
    "guide_generated_at": "2026-08-24T21:20:33+09:00",
    "preview_generator_prompt_id": "visual-preview-generator",
    "preview_generator_prompt_version": "2.2",
    "preview_generated_at": "2026-08-24T21:20:33+09:00"
  }
}
